navodila,,vrsta,proizvajalec,ime,širina,dolžina,višina,leto,serijska številka,polica,popisovalec,stanje,zgodovina
,,,,,,,,,,,,,
vrste eksponatov:,,Komponenta,Electronica Cerler s. a.,Matična plošča,22,37,3,,61023924,D4,Mateja,"Lepo ohranjena plošča, z več čipi, etc. V rjavi škatli. ",
Igralna konzola,,Računalnik,Commodore. ZDA,Commodore C64,41,21,8,1984,WG A375510,D4,Mateja,Lepo ohranjen. Zadaj ima tipko za reset. Na spodnji strani nalepka proizvajalca. Narejen v Z Nemčiji. ,VH00038
Mrežna oprema,,Podatkovni pogon,Commodore. ZDA,Commodore C2N Cassette,20,16,5,,2733244,D4,Mateja,"Lepo ohranjen. V kasetniku ima kaseto ""Quest for tires"", etc.",VH00038
Radio / Televizija,,Komponenta,Commodore. ZDA,Napajalnik ,14,8,8,1986,,D4,Mateja,Rjavskaste barve. Na spodnji strani črn žig APRIL 1986,VH00038
Dlančnik/Kalkulator,,Komponenta,Commodore. ZDA,Napajalnik ,14,8,8,1984,,D4,Mateja,Rjavskaste barve. Na spodnji strani rumen žig JAN 1984,VH00038
Ostalo,,Vnosna naprava,C&L,Joystick Gun shot,13,10,18,,,D4,Mateja,"Podnožje rumene barve, ročica ""commodorjeva"" zelena. V notranjosti se najbrž premika en vijak. ",VH00038
Podatkovni pogon,,Vnosna naprava,,Joystick CrackShot,8,11,17,,,D4,Mateja,"Črn, z rdečima gumboma. Zgoraj napis CrackShot. Spodaj na vijaku napisano Made in Hong Kong.",VH00038
Tiskalnik,,Telefon,"Iskra, Slovenija",Telefon ETA851/01,20,23,8,1992,106272,D4,Mateja,Rumene barve. Zgoraj polno nekih nalepk. Na spodnji strani nalepka proizvajalca. S flumastrom napisano MOJCA. Žig s slovenskim grbom.,
Komponenta,,Telefon,"Iskra, Jugoslavija",Telefon ATA-31K,16,21,9,,,D4,Mateja,Zelene barve. Zgoraj manjka pokrov. Desno pod številčnico nalepka s 383. Zraven ima še vtičnico za v steno.,
Terminal,,Telefon,"Iskra, Jugoslavija",Telefon ETA86,20,23,8,1987,88702,D4,Mateja,"Bež barve, s črno slušalko. Na spodnji strani nalepka proizvajalca. ",
Nosilec podatkov,,Telefon,"Iskra, Jugoslavija",Telefon ATA-61,14,20,11,,,D4,Mateja,Oranžne barve. S priključkom za v steno. ,
Vnosna naprava,,Telefon,"Iskra, Jugoslavija",Telefon ETA851/01,20,23,8,,125377,D4,Mateja,"Rdeče barve, s črno slušalko. Na zadnji strani nalepka proizvajalca. Slabo viden datum proizvodnje. S priključkom za v steno.",
Monitor,,Telefon,"Iskra, Slovenija",Telefon Comet (ETA155S),17,24,8,1993,114660,D4,Mateja,"Temno modre barve, s črno slušalko. Na spodnji strani nalepka proizvajalca. S priključkom za v steno.",
Računalnik,,Telefon,"Iskra, Jugoslavija",Telefon ETA86/10S,20,23,8,1988,51049,D4,Mateja,"Bež barve, s črno slušalko. Na spodnji strani nalepka proizvajalca. Kabel za vtičnoco v steni zelo kratek.",
,,Telefon,"Iskra, Jugoslavija",Telefon ETA851/01,20,23,8,1988,138338,D4,Mateja,"Rjav, s črno slušalko. Pod slušalko napisano DEK. Na spodnji strani nalepka proizvajalca.  Poleg kabel za v steno.",
"miši, joysticki, napajalniki ipd., se vpisejo posebej, ne kot del računalnika / konzole",,Vnosna naprava,"Silicon Graphics, ZDA",Miška (model: M-S43),7,12,3,,LZA90952808,D4,Mateja,Leva polovica porumenela. ,
,,Vnosna naprava,"Silicon Graphics, ZDA",Miška S100,6,10,3,,K718074,D4,Mateja,"Malce porumenela. Značilne ""granitne"" barve.",
"če za kak primerek nisi prepričan/a, kaj narest, ga raje pusti za kasneje",,Vnosna naprava,"Silicon Graphics, ZDA",SGI Indy kamera,16,5,6,,13479,D4,Mateja,"Zelo porumenela ta značilna ""granitna"" barva. S kablom.",
,,Nosilec podatkov,Digital Device System,Podatkovna kaseta,8,6,2,,,D4,Mateja,"Kaseta, 4mm, 4-60m. Na njej Spaceware, ver. 5.1. SGI-IRIX Dec 1992.",
"ja, dejansko rabiš meter, da zmeriš velikost",,Nosilec podatkov,Tektronix,"Magnetni trak 5.25"" Tektornix",15,10,1,,,D4,Mateja,V plastični škatlici. Spodaj desno nalepka s številko 10. ,
,,Nosilec podatkov,Tektronix,"Magnetni trak 5.25"" Tektornix",15,10,1,,,D4,Mateja,V plastični škatlici. Spodaj desno nalepka s številko 6.,
"pod stanje vnesi vizualno prepoznavne znake - barve, oblike, nalepke, praske, poškodbe",,Nosilec podatkov,Tektronix,"Magnetni trak 5.25"" Tektornix",15,10,1,,,D4,Mateja,V plastični škatlici z ostanki nalepke in rahlo počena.,
,,Podatkovni pogon,"Pertec Computer Corporation, ZDA",8 palčni disketni pogon (model: FD514),22,36,10,,,D4,Mateja,Lepo ohranjen. Spredaj nalepka Monitorjevega muzeja 83. Na notranji desni strani nalepka proizvajalca.,
,,Vnosna naprava,"Atari Corporation, ZDA",Miška STMI,6,10,3,,P28956625,D4,Mateja,Lepo ohranjena. Z dvema tipkama.,
,,Vnosna naprava,"IBM, ZDA",Miška (model: 13K6690),6,11,3,,23-500755,D4,Mateja,Lepo ohranjena. Z dvema tipkama.,
,,Vnosna naprava,"Apple, ZDA",Miška (G5431),6,10,3,,LI111184WYC22,D4,Mateja,Apple Desktop Bus Mouse. Z eno tipko. Bolj kvadratnega designa.,
,,Vnosna naprava,"Apple, ZDA",Miška (M2706),7,11,3,,,D4,Mateja,Apple Desktop Bus Mouse. Z eno tipko. ,
,,Vnosna naprava,"Apple, ZDA",Miška (M2706),7,11,3,,MI451084T 18,D4,Mateja,Apple Desktop Bus Mouse. Z eno tipko. Manjka pokrovček in kuglica.,
,,Vnosna naprava,"NeXT Computer, Inc., ZDA",Miška ,6,10,3,,AAF 6140454,D4,Mateja,Lepo ohranjena. ,
,,Vnosna naprava,Active Card,Čitalec kartic (model: ACTR-01),7,9,2,,989,D4,Mateja,Lepo ohranjen. Na zadnji strani nalepka proizvajalca.,
,,Vnosna naprava,,Čitalec DDS kaset,30,21,7,,,D4,Mateja,Lepo ohranjen. V njem še DDS kaseta. Zadaj SCSI vtičnica.,
,,Ostalo,,Elektronka,1,11,1,,,Predal 1,Mateja,"Steklena površina malce počena. Zadaj dolgo vezje. Notri  na ""ohišju"" napisana številka 11022.",
,,Ostalo,,Elektronka,2,7,2,,240550,Predal 1,Mateja,"Lepo ohranjena. Na njej napisi WF EABC 80 E7048, zadaj serijska in Gk 33. ",
,,Ostalo,"Siemens AG, Nemčija",Elektronka Röhre,3,9,3,,PCL 805,Predal 1,Mateja,"V original škatli, ki je malce poškodovana in pračna. Elektronka je najbrž pregorela - steklo je sajasto.",
,,Ostalo,"EI, Jugoslavija",Elektronka Noval,3,10,3,,PCF-802,Predal 1,Mateja,"V originalni škatlici, ki je poškodovana in elektronka gre kar težko ven - potrebno paziti, da se je ne strga. Na vrhu s kulijem napisano 48,49. Na elektronki napis Ei, Jugoslavija in serijska številka. Lepo ohranjena.",
,,Ostalo,"EI, Jugoslavija",Elektronka,3,10,3,,PCF-802,Predal 1,Mateja,"V originalni škatlici, ki je lepo ohranjena, malce prašna. Zgoraj na pokrovčku žig PCF-802. Ob inventariziranju elektronke nisem mogla spraviti iz škatlice. Porovčka se zelo težko odpirata in obstaja možnost uničenja/odtrganja.",
,,Ostalo,"Philips, Nizozemska",Elektronka,2,8,2,,PCL 82,Predal 1,Mateja,"V originalni škatlici, ne pokrovček poškodovan - manjka del, ki se zapira. Elektronka tudi lepa, na njen spodaj napis E9 6J.",
,,Ostalo,,Elektronka,4,12,4,,,Predal 1,Mateja,Brez škatle. Na njej napisano Valvo Pl 519. Steklo sajasto.,
,,Komponenta,"Iskra Delta, Jugoslavija",Centralna procesna enota 68010,26,19,1,,,C1,Mateja,"Centralno procesna enota z zanimivimi čipi (zilog, itd.). Na sprednji strani par konektorjev, reset tipka. Na srebrnem delu napis IDC. Dodani tudi vijaki.",
,,Komponenta,"Iskra Delta, Jugoslavija",Centralna procesna enota FD/WD,26,19,1,,C-2,C1,Mateja,"Centralno procesna enota z zanimivimi čipi (zilog, itd.). Spredaj, na srebrnem delu napis IDC. Dodani tudi vijaki.",
,,Računalnik,"Iskra Delta, Jugoslavija",Industrijska izvedba Triglav,47,47,30,,,C1,Mateja,Modro ohišje. Spredaj sloti za procesne enote. Ob strani ročaji. Na osnovi vodila VME.,VH00036
,,Monitor,"Nokia, Finska",Monitor Sun,36,37,38,1994,3651327-01,C3,Mateja,"Lepo ohranjen. Spredaj levo spodaj Sun logo. Zadaj nalepka: Manufactured: November, 1994. Made in Finland. Nokia naredila za Sun.",
,,Kalkulator,"Hewlett Packard, ZDA",Kalkulator HP 35,8,15,3,,,C4,Mateja,Lepo ohranjen. Z napajalnikom. Na zadnji strani navodila za uporabo. Zraven so prišle tudi baterije - smo jih dali ven.,VH00060
,,Kalkulator,"Novus, ZDA",Kalkulator 4515,8,16,3,1975,1006779,D7,Mateja,"Kalkulator je shranjen v manjši rjavi torbici z napisom Novus. Zraven tudi knjižica s ""trouble shooting tips"" in na papirju, s svinčnikom napisana navodila za računanje. Tudi na samem kalkulatorju na zadnji strani navodila.",
,,Kalkulator,,Kalkulator,7,12,1,,,D7,Mateja,"Srebrn kalkulator, brez napisa proizvajalca. Na zadnji strani le nalepka ""Made in Hong Kong.""",
,,Kalkulator,"Digitron, Jugoslavija",Kalkulator db 812,8,14,4,,,D7,Mateja,"Kalkulator je shranjen v črni škatlici, na zadnji strani ime proizvajalca. Kalkulator bele barve, z vzdignjenim zaslonom. Na zadnji strani nalepka z navodili za rokovanje. Spodaj na njej piše Made in Yugoslavia. Slabo vidna serijska številka.",
,,Računalnik,"Hewlett Packard, ZDA",HP Omnibook 425,28,16,4,,,D7,Mateja,Lepo ohranjen. ,
,,Računalnik,"Toshiba, Japonska",Libretto100CT,21,13,4,,68018490,D7,Mateja,Lepo ohranjen. Zgoraj napis proizvajalca in ime modela. Poleg napajalnik.,
,,Komponenta,"Option, Nizozemska",Kartica za brezžični internet,6,13,1,,OL4A57M1XB,D7,Mateja,"Globe trotter 3G quad kartica, v plastični škatli.",
,,Komponenta,,Adapter,5,9,1,,905998,D7,Mateja,Adapter PCMCIA to ATA/ATAPI. Priklopljena na kabel.,
,,Komponenta,,Disketna enota,14,17,3,2000,203K09R0476,D7,Mateja,"Disketna enota. Na zadnji strani priklop za slušalke, tipka za prižig, konektor. ",
,,Igralna konzola,Pocketsprite,Igralna konzola mini,3,6,1,,,D7,Mateja,Mini konzola. Shranjena v črni škatli na kateri piše PocketSprite z rdečimi črkami. Priložen tudi napajalnik. Delujoča.,VH00046
,,Komponenta,LifeView,Adapter za TV (model: LR502),5,13,3,,450806400958,D7,Mateja,Adapter za digitalni in analogno TV.,
,,Mrežna oprema,"Siemens AG, Nemčija",ISDN modem I-Surf USB,11,13,3,,682,D7,Mateja,"Lepo ohranjen. V original škatli, ki je sicer malce obrabljena. V njen navodila za uporabo.",
,,Tiskalnik,Hardtek,Vmesnik za ZX Spectrum tisklanik RS232,12,6,3,,,D7,Mateja,Shranjen v škatli. Vmesnik in Siemens konektor. ,
,,Nosilec podatkov,,Disk plošča,35,35,1,,,D7,Mateja,Disk plošča. Zgoraj z belim flomastrom napisano C:\WIN,VH00051
,,Nosilec podatkov,"Graham Magnetics, Inc., ZDA",Magnetni trak Verituf,27,27,2,,,D7,Mateja,Magnetni trak. Na nalepki napis Jenkins School of Business.,VH00051
,,Nosilec podatkov,"BASF SE, Nemčija",Magnetni trak 4610,29,28,2,,,D7,Mateja,Magnetni trak. Na njem nalepka Indiana University. In UE 0067. Na zadnji strani nalepka proizvajalca. ,VH00051
,,Nosilec podatkov,"LaCie, Ltd.",Trdi disk,17,24,7,,,D7,Mateja,"Trdi disk, v ohišju. S kablom za priklop na računalnik.",
,,Računalnik,"Compaq, ZDA",Prenosnik LTE 286,28,22,5,,,D7,Mateja,"Na zgornji strani pokrova nalepka SRC computers. Na zadnji strani se kar samo odpre pokrov konektorjev. Na levi strani nalepka s A - 100/111. Lep primerek. Shranjen v črni torbici. Gre pa kar na knap notri, potrebno paziti!",
,,Dlančnik,"Handspring Inc., Ltd",Dlančnik VISOR,8,12,2,,,D7,Mateja,"Res lep. Zadaj prozorna plastika, da se vidi v drobovje. Zgornji pkrovček se sname od zgoraj navzdol. ",
,,Dlančnik,"Palm Inc., ZDA",Dlančnik Palm IIIxe,8,12,2,,,D7,Mateja,Lepo ohranjen. Zadaj samo ena grda nalepka. ,
,,Vnosna naprava,"Apple, ZDA",Apple Magic Trackpad (sledilna ploščica),13,13,2,,,D7,Mateja,Srebrne barve. Model: A1339.,
,,Podatkovni pogon,"Digital, ZDA",Disketni pogon TLZ09,10,15,4,,,D7,Mateja,Lep primerek. ,
,,Vnosna naprava,"Logitech International S.A., Švica",ScanMan,14,14,4,,EB069205741-06,D7,matej,Nekoliko opraskan. Zraven je pripadajoča ISA kartica.,
,,Vnosna naprava,"IBM, ZDA",Tipkovnica Model M,50,21,5,1988,55-5826946,D7,matej,Na nekatere tipke so ročno napisani posebni znaki. Nanjo je priključen adapter z AT konektorja na PS/2.,
,,Podatkovni pogon,"Apple, ZDA",Macintosh HDI-20 External 1.4MB Floppy Disk Drive,12,18,3,1991,SA1494DH05A1,D7,matej,Lepo ohranjen.,
,,Ostalo,"Emulex, ZDA",Performance 4000,37,28,6,,BAN5684 PR,D7,matej,"Na zgornji strani je s flomastrom napisano ""TIP PRI, MB"", sicer umazano, a lepo ohranjeno.",
,,Računalnik,,Prenosnik Airis,36,26,3,,PNB518004742,D7,matej,Lepo ohranjen. Zraven sta baterija in napajalnik. V modri vreči SŠ Josipa Jurčiča Ivančna Gorica.,
,,Telefon,"Apple, ZDA",iPhone,6,12,1,,,D7,matej,Lepo ohranjen. V modri vreči SŠ Josipa Jurčiča Ivančna Gorica.,
,,Vnosna naprava,"Logitech International S.A., Švica",Brezžična miška Logitech,6,11,4,,,D7,matej,Lepo ohranjena. V modri vreči SŠ Josipa Jurčiča Ivančna Gorica.,
,,Komponenta,,Feritni pomnilnik na vezju,14,12,0,,,D7,matej,Lepo ohranjen.,VH00051
,,Komponenta,D-Link,DMF-560TXD,6,12,2,2000,B41J133000062,D7,matej,Lepo ohranjeno. V originalni škatli z dokumentacijo in mediji.,VH00051
,,Igralna konzola,,Žepna LCD igrica Ballonflug,10,6,2,,,D7,matej,Manjka pokrov za baterijo. Zvezana s 3 podobnimi igricami.,VH00051
,,Igralna konzola,,Žepna LCD igrica tenis,10,6,2,,,D7,matej,Manjka pokrov za baterijo. Zvezana s 3 podobnimi igricami.,VH00051
,,Igralna konzola,,Žepna LCD igrica Delphine,10,6,1,,,D7,matej,Manjka pokrov za baterijo. Zvezana s 3 podobnimi igricami.,VH00051
,,Igralna konzola,,Žepna LCD igrica,9,10,2,,,D7,matej,Okrogla. Manjka pokrov za baterijo. Zvezana s 3 podobnimi igricami.,
,,Telefon,LG,,5,10,1,,203CYMR992155,D7,matej,Flip phone. Vsebuje baterijo in kartico SIM.,
,,Telefon,Google,G1,6,12,2,,,D7,matej,"Ima fizično tipkovnico, ki se odpre kot npr. pri Sidekicku. Pod zaslonom so štirje gumbi. Proizvajalec ali model nista navedena, zadaj je majhen znak Androida.",
,,Telefon,"Nokia Corporation, Finska",3510i,5,12,2,,,D7,matej,"Modre barve, ob straneh oranžen. Vsebuje baterijo.",
,,Telefon,,Firefox OS Developer preview,6,12,1,,,D7,matej,Lepo ohranjen.,VH00056
,,Podatkovni pogon,Iomega,Zip 100 parallel port,13,18,3,1998,PREJ472FP1,D7,matej,"Lepo ohranjen. V originalni škatli z napajalnikom, dokumentacijo in programsko opremo.",
,,Telefon,"HTC, Tajvan",Telefon HTC,7,13,1,,1,D5,Mateja,"Lep, z rdečimi detajli. Na zadnji strani napis ""beatsaudio"" in logo b.",VH00067
,,Telefon,Sony Ericsson Mobile Communications,XPERIA,6,13,1,,,D5,Mateja,Lepo ohranjen. Na zadnji strani inventarna nalepka Ekipa2 d.o.o.: 100128.,VH00067
,,Telefon,"Sony Mobile Communications Inc., Japonska",XPERIA (rdeč),6,10,1,,,D5,Mateja,"Z ostrimi robovi, spodaj malce rdeč. Na zadnji strani nalepka MIRO MDPI.",VH00067
,,Telefon,"Samsung, Japonska",Telefon Samsung,6,11,1,,,D5,Mateja,"Klasičen, z gumbom spodaj na zaslonu. Zadaj inventarna nalepka Ekipa2 d.o.o.: 100123.",VH00067
,,Telefon,"Motorola Inc., ZDA",Defy+,6,11,1,,,D5,Mateja,"Zaščite konektorjev se ne da več zapreti. Na zadnji strani nalepka 107 Motorola Defy+, čez njo inventarna nalepka Ekipa2 d.o.o.: 100124.",VH00067
,,Telefon,"Nokia Corporation, Finska",Telefon Nokia,7,13,1,,,D5,Mateja,Spodnji del bel. Na zadnji strani inventarna nalepka Ekipa2 d.o.o.: 100614. In zelena WP: 8.1,VH00067
,,Telefon,"Nokia Corporation, Finska",Lumia 930,7,14,1,,,D5,Mateja,"Glede na ikonco Oken spodaj na sprednji strani, ima predvidoma Microsoft OS gor. Na zadnji strani inventarna številka Ekipa2 d.o.o.: 100564. In nalepka z modelom telefona.",VH00067
,,Telefon,"HTC, Tajvan",Evo 4G,6,12,1,,,D5,Mateja,Na sprednji strani desno zgoraj v kotu napis Sprint. Na zadnji strani inventarna nalepka Ekipa2 d.o.o.: 100126. In večja nalepka 100 in ime modela.,VH00067
,,Telefon,"HTC, Tajvan",4G LTE,6,12,1,,,D5,Mateja,Na spredni strani zgoraj napis Verizon. Zadaj inventarna nalepka Ekipa2 d.o.o.: 100119. Na srebrnem delu napis: with Google.,VH00067
,,Telefon,"Sony Mobile Communications Inc., Japonska",XPERIA (črn),6,13,1,,,D5,Mateja,Z ostrimi robovi. Na zadnji strani inventarna nalepka Ekipa2 d.o.o.: 100014 in rumena 4.1.2.,VH00067
,,Telefon,"Nokia Corporation, Finska",Lumia 830?,7,14,1,,,D5,Mateja,"Glede na ikonco Oken spodaj na sprednji strani, ima predvidoma Microsoft OS gor. Na zadnji strani inventarna številka Ekipa2 d.o.o.: 100577 in zelena WP 8.1.",VH00067
,,Telefon,"Samsung, Japonska",Galaxy S,6,12,1,,,D5,Mateja,"Klasičen, z gumbom spodaj na zaslonu. Zadaj inventarna nalepka Ekipa2 d.o.o.: 100144. Ter večja 109 in ime modela. Pa še nalepka z: Android 2.3.6. do not upgrade!!!",VH00067
,,Telefon,"Samsung, Japonska",Galaxy Chat?,6,12,1,,,D5,Mateja,S tipkovnico spodaj. Bel. Zadaj inventarna nalepka Ekipa2 d.o.o.: 100289.,VH00067
,,Telefon,"LG Electronics Inc., Južna Koreja",L4,6,11,1,,,D5,Mateja,"Bel, z ostrimi robovi. Na zadnji strani inventarna nalepka Ekipa2 d.o.o.: 100379; LG L4 in rumena z 4.1.2.",VH00067
,,Telefon,"Nokia Corporation, Finska",Lumia800?,6,12,1,,,D5,Mateja,"Moder. Glede na ikonco Oken spodaj na sprednji strani, ima predvidoma Microsoft OS gor. Zadaj nalepka z WP8 NOT!",VH00067
,,Telefon,"Sony Mobile Communications Inc., Japonska",XPERIA (bel),6,11,1,,,D5,Mateja,Bel. Z ostrimi robovi. Na zadnji strani inventarna nalepka Ekipa2 d.o.o.: 100362; in rumeno 4.1.1. Spodaj pa 3:2 MDPI.,VH00067
,,Telefon,"Nokia Corporation, Finska",Lumia 532,6,12,1,,,D5,Mateja,"Zgoraj napis Microsoft, tudi zadaj. Zadaj nalepka z imenom modela. Ter inventarna nalepka Ekipa2 d.o.o.: 100714.",VH00067
,,Telefon,"Apple, ZDA",iPhone  32GB,6,11,1,,,D5,Mateja,"Črn, bolj debel. Na zadnji strani slabo vidna inventarna nalepka Ekipa2 d.o.o.",VH00067
,,Telefon,"HTC, Tajvan",Telefon HTC,7,13,1,,2,D5,Mateja,"Lep, z rdečimi detajli. Na zadnji strani nalepka 100121.",VH00067
,,Tablica,"Samsung, Japonska",Galaxy Tab (model: GT-5110),26,18,1,,RF2D10DDA2B,D5,Mateja,Na zadnji strani roza nalepka Android 4.2 keep it. Bela PRIVATE 01 in spodaj 16:10.,VH00067
,,Tablica,"AsusTek Computer Inc., Tajvan",Fonepad (model: K004),12,20,1,,,D5,Mateja,"Črna, spodaj napis Asus. Na zadnji strani inventarna nalepka Ekipa2 d.o.o.: 100612. In spodaj nalepka 4.1.2 in 16 9.",VH00067
,,Tablica,"Lenovo, Kitajska",Tablica Lenovo,11,19,1,2017,HGCD1MEP(10),D5,Mateja,Z modrim robom. Zadaj velika nalepka loga Apple. Spodaj rumena nalepka 1.71. Inventarna nalepka Ekipa2 d.o.o.: 101135. ,VH00067
,,Tablica,"Samsung, Japonska",Galaxy Tab (model: GT-P1000),12,19,1,,R26B150657Y,D5,Mateja,"Zgoraj črna, zadaj bela. Zadaj velika nalepka 117, Samsung Galaxy Tab 7"". Spodaj inventarna nalepka Ekipa2 d.o.o.: 100108.",VH00067
,,Tablica,"Samsung, Japonska",Galaxy Tab 2 7.0 (model: GT-P3110),12,19,1,,R26B150657Y,D5,Mateja,S srebrnim robom. Zadaj rumena nalepka 16:9. Roza: Android 4.1-keep it. Inventarna nalepka Ekipa2 d.o.o.: 100107.,VH00067
,,Vnosna naprava,,USB spletna kamera,2,46,1,,,D5,Mateja,"USB kamera, s snemljivim pokrovčkom. Na njej nalepka Lidl.",VH00068
,,Ostalo,"Garmin, ZDA",Garmin nüvi 255,10,8,2,,1BW040474,D5,Mateja,"GPS naprava, z napajalnikom za v avtomobilsko vtičnico in ročko za pritrditev na gladko površino. Shranjeno v sivi vrečki.",VH00068
,,Dlančnik,"Dell, ZDA",Axim X51,7,12,2,,,D5,Mateja,"Lep, srebrno črna barvna kombinacija. Zadaj nalepka Designed for Windows Mobile. Shranjen v črnem etuiju.",VH00068
,,Ostalo,"Garmin, ZDA",Garmin Oregon 550,6,11,5,,,D5,Mateja,"GPS naprava, s sponko za pas.",VH00068
,,Ostalo,"Casio, Japonska",Pametna ura,4,23,1,,,D5,Mateja,"Pametna ura, s kamero. Zadaj na gumijastem paščku napisano Fotona. Vrgravirano Laguna.",VH00068
,,Ostalo,"Garmin, ZDA",Garmin,4,9,2,,,D5,Mateja,Garmin. Zadaj nalepljen velkro.,VH00068
,,Telefon,"Siemens AG, Nemčija",M 35,5,12,2,,,D5,Mateja,Telefon na tipke. ,VH00068
,,Telefon,"Samsung, Japonska",Telefon na preklop,4,8,2,,,D5,Mateja,Samsung telefon na preklo. Se ga da še napolnit. Ko ga odpreš se napiše na displeju: Insert SIM card.,VH00068
,,Telefon,"HTC, Tajvan",Telefon HTC (srebrn),6,11,2,,,D5,Mateja,"HTC telefon, zgoraj srebrne barve. Zadaj na kameri piše 3.0 M pixels.",VH00068
,,Telefon,"BlackBerry Ltd., Kanada",Telefon Blackberry,6,11,1,,,D5,Mateja,"BlackBerry, spodaj napis vodafone. ",VH00068
,,Telefon,"Nokia Corporation, Finska",Telefon Nokia (manjša),5,10,2,,,D5,Mateja,Starejša Nokia. Pod ekranom napis vodafone. ,VH00068
,,Telefon,"Nokia Corporation, Finska",Telefon Nokia (srebrn),5,10,2,,,D5,Mateja,"Starejša Nokia, srebrne barve. Zadaj napis vodafone.",VH00068
,,Vnosna naprava,Muvi,Kamera,5,2,3,,,D5,Mateja,Miniaturna kamera. ,VH00068
,,Monitor,"Hewlett - Packard, ZDA",A1097C,50,49,49,1992,3151J46416,večnamenska,Mateja,Od podjetja Elta.,VH00071 
,,Računalnik,"Hewlett - Packard, ZDA",Apollo Series 700,26,50,53,1992,6239A03016,večnamenska,Mateja,,VH00071 
,,Ostalo ,,RGB BNC kabel,,,,,,večnamenska,Mateja,,VH00071 
,,Vnosna naprava,"Hewlett - Packard, ZDA",HP tipkonica (model: 46021A) ,46,23,3,1992,2936S50572,večnamenska,Mateja,Lepo ohranjena.,VH00071 
,,Vnosna naprava,"Hewlett - Packard, ZDA",HP miška (model: 46060B),6,10,4,1992,3223S204699,večnamenska,Mateja,Lepo ohranjena.,VH00071 
,,Vnosna naprava,"Hewlett - Packard, ZDA",HP miška (model: 46060B),6,10,4,1992,3238S21300,večnamenska,Mateja,Lepo ohranjena.,VH00071 
,,Vnosna naprava,"Hewlett - Packard, ZDA",HP ID modul,9,6,3,,2944A19258,večnamenska,Mateja,,VH00071 
,,Vnosna naprava,"Hewlett - Packard, ZDA",HP ID modul,9,6,3,,2529A94836,večnamenska,Mateja,,VH00071 
,,Računalnik,"Apple, ZDA",Power Mac G4 (AGP Graphics),22,47,44,2000,CK0230M4HSE,večnamenska,Mateja,"Tower iz akrilne plastike, siv in temnomoder, nekaj prask",VH00071 
,,Monitor,"Apple, ZDA","Studio Display 15""",40,21,54,1998,,večnamenska,Mateja,,VH00071 
,,Računalnik,"Apple, ZDA",Power Mac G4 (Quicksilver),22,47,44,2002,CK203J3AM38,večnamenska,Mateja,"Tower iz akrilne plastike, siv / srebrn nekaj prask",VH00071 
,,Monitor,"Apple, ZDA","Cinema Display 20""",54,10,45,2003,N530727DNAF,večnamenska,Mateja,,VH00071 
,,Vnosna naprava,"Hewlett - Packard, ZDA",HP SCSI trdi disk (model: C2235),10,14,4,,3200A72073,večnamenska,Mateja,,VH00071 
,,Vnosna naprava,"Hewlett - Packard, ZDA",HP SCSI trdi disk (model: C2235),10,14,4,,3200A71149,večnamenska,Mateja,,VH00071 
,,Kalkulator,,Kalkulator SR-80,8,15,3,1977,,C3,Mateja,"Kalkulator, shranjen v usnjenem etuiju. Nad ekrančkom napis ASARI SR-80 (?). V etuiju so tudi navodila za uporabo v angleškem jeziku. Na notranji strani navodil žig prodajalca in datum prodaje (?): 16 APR. 1977 Ditto VENCESLAO KLANISCEK, Via Duca d'Aosta 35 - Tel. 2258 GORIZIA. Na zadnji strani ime JANEZ PIBER.",
,,Kalkulator,"Digitron, Jugoslavija",DB 803,7,14,4,,,C3,Mateja,"Shranjen je v črni škatli, na pokrovu zgoraj napis digitron. Škatla z rdečim žametom na notranji strani. Na spodnji strani škatle napisana informacija o napajanju. V škatli se nahaja tudi napajalnik. Zraven tudi listek, na katerem piše: Slab kontakt v napajalniku. Sicer deluje. Marko Vrtovec.",
,,Kalkulator,"Sharp, Japonska",EL-512,7,13,1,,,C3,Mateja,"V črnem, plastičnem etuiju na preklop. ",
,,Dlančnik,"Palm, ZDA",Palm IIIe,9,12,2,,B0DF15D00114,C2,Mateja,"Lepo ohranjen, zraven tudi stilus. Ohišje narejeno iz prosojne plastike. Poleg je tudi napajalnik 3Com - mogoče ni originalen. ",
,,Nosilec podatkov,"Digital, ZDA",Magnetni trak,19,19,2,,,D6,Mateja,"Na njem nalepka MT 1 SYSprogr. + IGRE. Zraven je tudi računalniški neskončni papir, na katerem piše, kaj je zapisano na traku, imena datotek.",
,,Nosilec podatkov,"Digital, ZDA",Magnetni trak,19,19,2,,,D6,Mateja,"Na njem nalepka Programi IMRAMO MT2 1. 6. 1997. Zraven tudi računalniški papir, na katerem so napisane imena datotek, ki so gor.",
,,Kalkulator,"Hewlett - Packard, ZDA",HP 48SX,8,18,3,,,C3,Mateja,Zelo lepo ohranjen. Shranjen v etuiju z zadrgo in napisom Hewlett Packard. Notri tudi navodila za uporabo. Zraven pa še dve knjigi z navodili za uporabo. ,VH00072
,,Telefon,"Nokia Corporation, Finska",Nokia z Windows 10,7,13,2,,,D6,Mateja,Zadnji del rumene barve.,VH00072
,,Telefon,"HTC Corporation, Kitajska",Nexus One,6,12,1,,,D6,Mateja,Nexus One. Zadaj napis HTC in Google,VH00072
,,Ostalo ,"Franklin Electronics Publishers Inc., ZDA",REX-3 ,9,6,1,1987,,C2,Mateja,Lepo ohranjen. Še dela. ,VH00072
,,Prenosnik,"Toshiba, Japonska",Satellite 110CS,30,24,6,,10678177,D7,Nejc,"Lepo ohranjen, temno sive barve v ohišju shranjena še 3,5-inčna disketa. Na njen napis 5/5.",
,,Komponenta,"Hewlett - Packard, ZDA",Omrežni kontroler za tiskalnik (HP JETDIRECT EX J2382),14,12,3,,J2382-60003,D6,Nejc,Lepo ohranjen. Made in Singapore.,
,,Nosilec podatkov,"Seagate, ZDA",Trdi disk (model ST-225),15,20,4,,904002-002,D6,Nejc,Lepo ohranjen. na zgornji strani nalepka s številko modela.,
,,Vnosna naprava,"Monterey international. corp., Tajvan",tipkovnica (model K104),49,22,4,,6958,D7,Nejc,"Lepo ohranjena, a zelo umazana. Na tipki enter ostanki barvice. Zraven je tudi kabel za priklop na računalnik.",
,,Prenosnik,"IBM, ZDA",ThinkPad X40,27,21,5,,,D6,Nejc,"Lepo ohranjen, na spodnji strani nalepka z črtno kodo in številko 8808. Zraven tudi 2 polnilca od tega eden original IBM.",
,,Vnosna naprava,"Sony, Japonska",Kontroler (model SCPH-1010),15,9,4,,,D7,Nejc,Lepo ohranjen. Bil je v škatli v ostalim nintendo development kitom.,
,,Vnosna naprava,"Sony, Japonska",Kontroler (model SCPH-1010),15,9,4,,,D7,Nejc,Lepo ohranjen. Bil je v škatli v ostalim nintendo development kitom.,
,,Komponenta,"Micomsoft, Japonska",Konverter (XRGB-1),21,12,3,,11047,D7,Nejc,Lepo ohranjen. Poleg tudi napajalnik (model JOD-41-051). Zraven tudi kabel za priklop na monitor in navodila za uporabo v japonščini.,
,,Komponenta,"Psygnosis, Velika Britanija",Plošča z vezjem in čipi,14,19,2,1994,89633,D7,Nejc,Lepo ohranjena. Uporabljala se je kot del development kita za Playstation.,
,,Tiskalnik,"Fujitsu, Japonska",Tiskalnik model M3043 VDE,70,105,105,,14239,pritličje,Mateja,Lepo ohranjen. Še dela. Težek 200kg! Je na koleščkih in ga je lahko premikati horizontalno. ,VH00069